{
  "schema_version": "prompt-pipeline-lifecycle-ledger.v1",
  "ledger_id": "PROMPT-QUALITY-LIFECYCLE-PROGRAM-ACTIVATION",
  "ledger_hash": "sha256:ea49a488a99d5b0205a6d8a63ba24056ed82251ca2c66f4fbfeed57e5cf08d33",
  "repository": "rezahh107/Prompt-Pipeline",
  "program_id": "PROMPT-QUALITY-MIGRATION-EXECUTION-PROGRAM",
  "task_id": "PROMPT-QUALITY-PROGRAM-ACTIVATION",
  "pull_request": 29,
  "base_sha": "25bd3af631c17fbfda76a3cabcaa612dfdc11143",
  "scope_revision": "sha256:86b9aef93b9602de6b7e5af019da26340ef82a67c3b0ae1ed450e93d9ab0fb8a",
  "branch_kind": "default",
  "completion_claim": true,
  "next_required_event": null,
  "events": [
    {"event_id":"PROMPT-QUALITY-EVENT-0001","event_version":1,"event_type":"start_preflight","predecessor_event_id":null,"occurred_at":"2026-07-18T12:25:10Z","repository":"rezahh107/Prompt-Pipeline","program_id":"PROMPT-QUALITY-MIGRATION-EXECUTION-PROGRAM","task_id":"PROMPT-QUALITY-PROGRAM-ACTIVATION","pull_request":null,"base_sha":"25bd3af631c17fbfda76a3cabcaa612dfdc11143","head_sha":null,"scope_revision":"sha256:1547c9f41164ef39464d3b1bfe91c7762ae4110d6d27b7f4c1d23666e363c511","evidence":[{"kind":"live repository identities inspected","reference":"rezahh107/Prompt-Pipeline@25bd3af631c17fbfda76a3cabcaa612dfdc11143; EV4-Decision-Kernel@5b25e9e7f43071e1ac5a7e5e798a3600838e5b2a","sha256":"e2ba2d869c1b6bbdbb51acf979c2475e4d05ed4797f32c175245474370ef5567"}],"event_hash":"sha256:4d45799cddfee23aacf12e760d5d8182c781b830a2da16b077d39bbccf4419ee"},
    {"event_id":"PROMPT-QUALITY-EVENT-0002","event_version":1,"event_type":"scope_committed","predecessor_event_id":"PROMPT-QUALITY-EVENT-0001","occurred_at":"2026-07-18T12:25:11Z","repository":"rezahh107/Prompt-Pipeline","program_id":"PROMPT-QUALITY-MIGRATION-EXECUTION-PROGRAM","task_id":"PROMPT-QUALITY-PROGRAM-ACTIVATION","pull_request":null,"base_sha":"25bd3af631c17fbfda76a3cabcaa612dfdc11143","head_sha":null,"scope_revision":"sha256:1547c9f41164ef39464d3b1bfe91c7762ae4110d6d27b7f4c1d23666e363c511","evidence":[{"kind":"initial exact-files activation scope authorized","reference":"planning/prompt-quality/scopes/PROMPT-QUALITY-PROGRAM-ACTIVATION.scope.json#sha256:d85e0e87334b335d9f0ff87ca0eb1e26029632c27841a169959eacaf66e3e11f","sha256":"ad1e8d2834f65268359e242fc9eebe1f550fc9ae36637819a852142236188a60"}],"event_hash":"sha256:db8c47b43e8ce7509e8b3354c43fd16adf5778b822996b2da7a2a307495133ce"},
    {"event_id":"PROMPT-QUALITY-EVENT-0003","event_version":1,"event_type":"scope_amended","predecessor_event_id":"PROMPT-QUALITY-EVENT-0002","occurred_at":"2026-07-18T12:25:12Z","repository":"rezahh107/Prompt-Pipeline","program_id":"PROMPT-QUALITY-MIGRATION-EXECUTION-PROGRAM","task_id":"PROMPT-QUALITY-PROGRAM-ACTIVATION","pull_request":null,"base_sha":"25bd3af631c17fbfda76a3cabcaa612dfdc11143","head_sha":null,"scope_revision":"sha256:1547c9f41164ef39464d3b1bfe91c7762ae4110d6d27b7f4c1d23666e363c511","evidence":[{"kind":"scope amendment authorized before module creation","reference":"scripts/prompt-quality-governance/{core,program,scope-progress,lifecycle,fixtures-program-scope,fixtures-progress-lifecycle,fixtures}.mjs","sha256":"01c6d3d27155213450c2297dfcd2f671f113f77491586068b556efc9b4123c24"}],"event_hash":"sha256:988b840a27d15eccab34d0d0e9d4fd88557b379faf0c00b45cd457d08e54a26e"},
    {"event_id":"PROMPT-QUALITY-EVENT-0004","event_version":1,"event_type":"scope_disclosed","predecessor_event_id":"PROMPT-QUALITY-EVENT-0003","occurred_at":"2026-07-18T12:25:13Z","repository":"rezahh107/Prompt-Pipeline","program_id":"PROMPT-QUALITY-MIGRATION-EXECUTION-PROGRAM","task_id":"PROMPT-QUALITY-PROGRAM-ACTIVATION","pull_request":null,"base_sha":"25bd3af631c17fbfda76a3cabcaa612dfdc11143","head_sha":null,"scope_revision":"sha256:1547c9f41164ef39464d3b1bfe91c7762ae4110d6d27b7f4c1d23666e363c511","evidence":[{"kind":"declared activation path set disclosed","reference":"package.json\nplanning/NEXT_WORK.md\nplanning/PROMPT_QUALITY_EXECUTION_PLAN.md\nplanning/prompt-quality/current-scope.json\nplanning/prompt-quality/diagnostics/prompt-quality-diagnostics.v1.json\nplanning/prompt-quality/fixtures/adversarial.json\nplanning/prompt-quality/fixtures/invalid.json\nplanning/prompt-quality/fixtures/valid.json\nplanning/prompt-quality/impacts/0001-PROMPT-QUALITY-PROGRAM-ACTIVATION.json\nplanning/prompt-quality/lifecycle/PROMPT-QUALITY-PROGRAM-ACTIVATION.ledger.json\nplanning/prompt-quality/prompt-quality-execution-program.v1.json\nplanning/prompt-quality/schemas/prompt-pipeline-lifecycle-ledger.v1.schema.json\nplanning/prompt-quality/schemas/prompt-pipeline-progress-impact.v1.schema.json\nplanning/prompt-quality/schemas/prompt-pipeline-task-scope.v1.schema.json\nplanning/prompt-quality/schemas/prompt-quality-execution-program.v1.schema.json\nplanning/prompt-quality/scopes/PROMPT-QUALITY-PROGRAM-ACTIVATION.scope.json\nscripts/peac-prompt-quality-governance.mjs\nscripts/prompt-quality-governance/core.mjs\nscripts/prompt-quality-governance/fixtures-program-scope.mjs\nscripts/prompt-quality-governance/fixtures-progress-lifecycle.mjs\nscripts/prompt-quality-governance/fixtures.mjs\nscripts/prompt-quality-governance/lifecycle.mjs\nscripts/prompt-quality-governance/program.mjs\nscripts/prompt-quality-governance/scope-progress.mjs","sha256":"00d7821c4dca3afbc68b9fca45f3152d80757ac522d9744590d6225fe1db2580"}],"event_hash":"sha256:6d01878aa3ba603586ea5f7acd2d01a6ee866bc3b848df39921449bdcbf519a2"},
    {"event_id":"PROMPT-QUALITY-EVENT-0005","event_version":1,"event_type":"implementation_complete","predecessor_event_id":"PROMPT-QUALITY-EVENT-0004","occurred_at":"2026-07-18T12:25:14Z","repository":"rezahh107/Prompt-Pipeline","program_id":"PROMPT-QUALITY-MIGRATION-EXECUTION-PROGRAM","task_id":"PROMPT-QUALITY-PROGRAM-ACTIVATION","pull_request":null,"base_sha":"25bd3af631c17fbfda76a3cabcaa612dfdc11143","head_sha":null,"scope_revision":"sha256:1547c9f41164ef39464d3b1bfe91c7762ae4110d6d27b7f4c1d23666e363c511","evidence":[{"kind":"bounded governance foundation materialized","reference":"ACT-001\nACT-002\nACT-003\nACT-004\nACT-005\nACT-006\nACT-007\nACT-008\nACT-009","sha256":"cd9e78e12c4be089ebe7b1f4ed6002540defe2bbcea237ba8d2da4b5b89e6c34"}],"event_hash":"sha256:5807bb70d9f78ba68154977d3c82335f0c23e0f95e85a1cd522cd33106680a26"},
    {"event_id":"PROMPT-QUALITY-EVENT-0006","event_version":1,"event_type":"exact_head_validated","predecessor_event_id":"PROMPT-QUALITY-EVENT-0005","occurred_at":"2026-07-18T20:42:40Z","repository":"rezahh107/Prompt-Pipeline","program_id":"PROMPT-QUALITY-MIGRATION-EXECUTION-PROGRAM","task_id":"PROMPT-QUALITY-PROGRAM-ACTIVATION","pull_request":29,"base_sha":"25bd3af631c17fbfda76a3cabcaa612dfdc11143","head_sha":"c028f7009909fa57ef55ff0a922477f0c32ef484","scope_revision":"sha256:86b9aef93b9602de6b7e5af019da26340ef82a67c3b0ae1ed450e93d9ab0fb8a","evidence":[{"kind":"authoritative_exact_head_ci","reference":"github-actions://rezahh107/Prompt-Pipeline/runs/29660193834/jobs/88121422303/artifacts/8434088383","sha256":"6bb8425e009606af86f3693e08ec399a5da1ca0b63b04fa0225bfec8bd056ab6"}],"event_hash":"sha256:c9d6ca2ced147df094b5c1379acd11839e8fec90d9377de43274c47f5ea8a05c"},
    {"event_id":"PROMPT-QUALITY-EVENT-0007","event_version":1,"event_type":"owner_merge","predecessor_event_id":"PROMPT-QUALITY-EVENT-0006","occurred_at":"2026-07-18T21:12:18Z","repository":"rezahh107/Prompt-Pipeline","program_id":"PROMPT-QUALITY-MIGRATION-EXECUTION-PROGRAM","task_id":"PROMPT-QUALITY-PROGRAM-ACTIVATION","pull_request":29,"base_sha":"25bd3af631c17fbfda76a3cabcaa612dfdc11143","head_sha":"e3f98e007bba01ba02310b01377f617c94ca8b09","scope_revision":"sha256:86b9aef93b9602de6b7e5af019da26340ef82a67c3b0ae1ed450e93d9ab0fb8a","evidence":[{"kind":"authoritative_owner_merge","reference":"planning/prompt-quality/evidence/sources/pr-29-owner-merge.raw.json#sha256:24ef02f3938a76ca47e81cc2684e983e73d5e838aa1f0a393744e7023d4dde12","sha256":"016fd797ede433e7cadffc78106ea48ab2b65390dc5cb0db82bf3fc5d964770f"}],"event_hash":"sha256:ed5c34e3de16b0774a5c6973f950e69842a9d489143fb27f82daed19cc182fc9"},
    {"event_id":"PROMPT-QUALITY-EVENT-0008","event_version":1,"event_type":"exact_main_verified","predecessor_event_id":"PROMPT-QUALITY-EVENT-0007","occurred_at":"2026-07-18T21:12:19Z","repository":"rezahh107/Prompt-Pipeline","program_id":"PROMPT-QUALITY-MIGRATION-EXECUTION-PROGRAM","task_id":"PROMPT-QUALITY-PROGRAM-ACTIVATION","pull_request":29,"base_sha":"25bd3af631c17fbfda76a3cabcaa612dfdc11143","head_sha":"e3f98e007bba01ba02310b01377f617c94ca8b09","scope_revision":"sha256:86b9aef93b9602de6b7e5af019da26340ef82a67c3b0ae1ed450e93d9ab0fb8a","evidence":[{"kind":"authoritative_exact_main","reference":"github://rezahh107/Prompt-Pipeline/main@e3f98e007bba01ba02310b01377f617c94ca8b09#github_default_branch_ref_and_compare.v1","sha256":"db3e4eb2717aea0d01f08ed88fbb6530d8a502876b7937807f81558172615a9f"}],"event_hash":"sha256:cab3387a756b53985cad1ec898cb06b2795930dabc084a7a2d43c1355c897a0e"}
  ]
}
